dimension_type,series_type,label,label_key,group_label,adds,removes,window_net,total_moves,early_avg_net,late_avg_net,momentum_delta,sample_apps
tag,raw-tag,Visual Novel,visual novel,Other,9,6,3,15,0.5000,0.1250,-0.3750,"Pretty Girl Puzzle · Summer Phantom, AIKO: AI Girlfriend 3D Life Sim, The Worlds of Narayana VR"
tag,raw-tag,Voxel,voxel,Other,1,2,-1,3,-0.1250,-0.1250,0.0000,"Dodge-imals, Long Drive North: Co-Op RV Simulator, Microlandia"
tag,raw-tag,VR,vr,Other,8,6,2,14,-0.2500,0.2500,0.5000,"Subliminal, The Worlds of Narayana VR, Attack on Titan 2 - A.O.T.2"
tag,raw-tag,Walking Simulator,walking simulator,Other,8,9,-1,17,-0.1250,0.2500,0.3750,"Before the Silence Claims: In Absentia, The Floor Above, Island of Giant Trees"
tag,raw-tag,War,war,Other,9,7,2,16,0.2500,0.1250,-0.1250,"Power Of The Horde, Riftborne, SIRENS"
tag,raw-tag,Wargame,wargame,Other,4,5,-1,9,0.0000,-0.2500,-0.2500,"Power Of The Horde, Warnet, Virtualord, The Virtual Conqueror"
tag,raw-tag,Werewolves,werewolves,Other,1,0,1,1,0.0000,0.0000,0.0000,Werewolf: The Inner Beast
tag,raw-tag,Wholesome,wholesome,Other,7,2,5,9,0.1250,0.2500,0.1250,"With Me: Aquatic Time, Cozy Cleaner, Tiny Ducks: Desktop Bath"
tag,raw-tag,Word Game,word game,Other,2,1,1,3,-0.1250,0.2500,0.3750,"Under Protocol, KeyBreach"
tag,raw-tag,World War II,world war ii,Other,0,1,-1,1,-0.1250,0.0000,0.1250,A Foreign World
tag,raw-tag,Zombies,zombies,Other,7,7,0,14,0.1250,0.0000,-0.1250,"UP TO THE SKY, KeepUp Survival, Fading Faith"
